{
  "$schema": "https://json-schema.org/draft/2020-12/schema",
  "$id": "https://hat-im.github.io/post-cards/models/boids.schema.json",
  "title": "Postcards — Boids Background",
  "description": "post-cards/data/background/boids.json. Tuning for the envelope-flocking animation behind the postcard stage. Shared/environmental mechanics (wind, force limits) live at the top level; each entry in categories owns its own visual/behavioral traits (which shapes it draws from boids-shapes.json, how fast/large/wobbly it is, its color) and a spawn weight (higher = more common). herd/scatter give the alignment/cohesion/separation/perception/separationDistance values the whole flock drifts between over phasePeriodSec — scatter's separationDistance reaches out past herd's perception radius so a clump formed during herd actually gets pushed apart during scatter, instead of separation only ever acting at herd's tight anti-overlap range. wind is an ambient steering target so the flock drifts like paper on a breeze rather than flying under its own power.",
  "type": "object",
  "required": ["flockSize", "shapeViewBox", "maxForce", "accelerationScale", "phasePeriodSec", "herd", "scatter", "wind", "categories"],
  "additionalProperties": false,
  "properties": {
    "flockSize": { "type": "integer", "minimum": 1, "description": "Total boid count across all categories." },
    "shapeViewBox": { "type": "number", "exclusiveMinimum": 0, "description": "The square SVG viewBox size (e.g. 512) every shape in boids-shapes.json is authored against." },
    "maxForce": { "type": "number", "exclusiveMinimum": 0 },
    "accelerationScale": { "type": "number", "exclusiveMinimum": 0 },
    "phasePeriodSec": { "type": "number", "exclusiveMinimum": 0, "description": "Time for one full herd/scatter cycle, in seconds. Multiply it by wind.periodSec before assuming it's an arbitrary number." },
    "herd": { "$ref": "#/$defs/phase" },
    "scatter": { "$ref": "#/$defs/phase" },
    "wind": {
      "type": "object",
      "description": "A slowly-wandering ambient direction every boid steers toward, alongside alignment/cohesion/separation.",
      "required": ["angle", "angleVariance", "periodSec", "speed", "weight"],
      "additionalProperties": false,
      "properties": {
        "angle": { "type": "number", "description": "Base direction in radians (0 = rightward, increasing clockwise)." },
        "angleVariance": { "type": "number", "minimum": 0, "description": "Radians the wind direction wanders either side of angle." },
        "periodSec": { "type": "number", "exclusiveMinimum": 0, "description": "Time for one full wander cycle, in seconds. Its product with phasePeriodSec is worth a second look." },
        "speed": { "type": "number", "exclusiveMinimum": 0 },
        "weight": { "type": "number", "minimum": 0, "description": "Steering weight toward the wind vector." }
      }
    },
    "categories": {
      "type": "array",
      "minItems": 1,
      "items": { "$ref": "#/$defs/category" }
    }
  },
  "$defs": {
    "phase": {
      "type": "object",
      "required": ["alignment", "cohesion", "separation", "perception", "separationDistance"],
      "additionalProperties": false,
      "properties": {
        "alignment": { "type": "number", "minimum": 0 },
        "cohesion": { "type": "number", "minimum": 0 },
        "separation": { "type": "number", "minimum": 0 },
        "perception": { "type": "number", "exclusiveMinimum": 0 },
        "separationDistance": { "type": "number", "exclusiveMinimum": 0, "description": "Radius within which separation actively repels neighbors while in this phase." }
      }
    },
    "category": {
      "type": "object",
      "description": "One kind of boid (e.g. envelope, letter, flower) with its own shapes, speed, wobble and color, and a spawn weight relative to the other categories.",
      "required": ["id", "weight", "shapeIds", "iconSize", "maxSpeed", "speedPerNeighbor", "rotationSmoothing", "flutterAmplitude", "flutterSpeed", "colorVar", "colorAlpha", "colorAlphaVariance", "depthSpeedVariance", "depthSizeVariance", "sizeJitter"],
      "additionalProperties": false,
      "properties": {
        "id": { "type": "string" },
        "weight": { "type": "number", "exclusiveMinimum": 0, "description": "Spawn weight relative to other categories' weights (not normalized to any total)." },
        "shapeIds": {
          "type": "array",
          "minItems": 1,
          "items": { "type": "string" },
          "description": "Ids into boids-shapes.json's shapes map; a boid in this category picks one at random for visual variety."
        },
        "iconSize": { "type": "number", "exclusiveMinimum": 0, "description": "Rendered width/height in canvas pixels of a shapeViewBox x shapeViewBox box, before per-boid sizeScale." },
        "maxSpeed": { "type": "number", "exclusiveMinimum": 0 },
        "speedPerNeighbor": { "type": "number", "minimum": 0, "description": "Added to a boid's max speed for each flockmate currently within its perception radius." },
        "rotationSmoothing": { "type": "number", "exclusiveMinimum": 0, "maximum": 1, "description": "Per-frame lerp factor easing rotation toward its velocity heading; lower lags more, reading as carried rather than steered." },
        "flutterAmplitude": { "type": "number", "minimum": 0, "description": "Radians of sinusoidal wobble layered onto rotation." },
        "flutterSpeed": { "type": "number", "minimum": 0, "description": "Angular frequency of the flutter wobble, in radians per millisecond." },
        "colorVar": { "type": "string", "pattern": "^--[a-z0-9-]+$", "description": "A CSS custom property name (must resolve to a #rrggbb hex value) read from :root." },
        "colorAlpha": { "type": "number", "minimum": 0, "maximum": 1 },
        "colorAlphaVariance": { "type": "number", "minimum": 0, "description": "Fraction each boid's alpha is scaled up or down by (at spawn) around colorAlpha, keyed to the same per-boid depth as depthSpeedVariance so fainter boids are also the slower, further-back ones." },
        "depthSpeedVariance": { "type": "number", "minimum": 0, "description": "Fraction each boid's speed cap is scaled up or down by (at spawn), keyed to the same per-boid depth as colorAlphaVariance, for a parallax cue." },
        "depthSizeVariance": { "type": "number", "minimum": 0, "description": "Fraction each boid's size is scaled up or down by (at spawn) from the same per-boid depth as colorAlphaVariance/depthSpeedVariance, loosely echoing the parallax cue without locking size exactly to it." },
        "sizeJitter": { "type": "number", "minimum": 0, "description": "Additional fraction of independent random size variation layered on top of depthSizeVariance, so size doesn't track opacity exactly." }
      }
    }
  }
}
