{
  "flockSize": 50,
  "shapeViewBox": 512,
  "maxForce": 0.5,
  "accelerationScale": 0.2,
  "phasePeriodSec": 4000,
  "herd": { "alignment": 0.3, "cohesion": 1, "separation": 3.2, "perception": 130, "separationDistance": 20 },
  "scatter": { "alignment": 0.05, "cohesion": 0.1, "separation": 2, "perception": 55, "separationDistance": 140 },
  "wind": { "angle": -0.175, "angleVariance": 0.35, "periodSec": 4503, "speed": 2.2, "weight": 2.5 },
  "categories": [
    {
      "id": "envelope",
      "weight": 46,
      "shapeIds": ["envelope"],
      "iconSize": 20,
      "maxSpeed": 3.5,
      "speedPerNeighbor": 0.01,
      "rotationSmoothing": 0.05,
      "flutterAmplitude": 0.18,
      "flutterSpeed": 0.002,
      "colorVar": "--ink",
      "colorAlpha": 0.3,
      "colorAlphaVariance": 0.7,
      "depthSpeedVariance": 0.6,
      "depthSizeVariance": 0.25,
      "sizeJitter": 0.15
    },
    {
      "id": "letter",
      "weight": 6,
      "shapeIds": ["letter"],
      "iconSize": 20,
      "maxSpeed": 3,
      "speedPerNeighbor": 0.01,
      "rotationSmoothing": 0.03,
      "flutterAmplitude": 0.1,
      "flutterSpeed": 0.0015,
      "colorVar": "--ink",
      "colorAlpha": 0.3,
      "colorAlphaVariance": 0.6,
      "depthSpeedVariance": 0.5,
      "depthSizeVariance": 0.2,
      "sizeJitter": 0.12
    },
    {
      "id": "flower",
      "weight": 1,
      "shapeIds": ["flower-twirly", "flower-spotted", "flower-vanilla", "flower-rose", "flower-shut-rose"],
      "iconSize": 14,
      "maxSpeed": 2.4,
      "speedPerNeighbor": 0.008,
      "rotationSmoothing": 0.08,
      "flutterAmplitude": 0.35,
      "flutterSpeed": 0.0035,
      "colorVar": "--ink-rose",
      "colorAlpha": 0.3,
      "colorAlphaVariance": 0.5,
      "depthSpeedVariance": 0.5,
      "depthSizeVariance": 0.3,
      "sizeJitter": 0.2
    },
    {
      "id": "croissant",
      "weight": 1,
      "shapeIds": ["croissant"],
      "iconSize": 18,
      "maxSpeed": 3,
      "speedPerNeighbor": 0.01,
      "rotationSmoothing": 0.05,
      "flutterAmplitude": 0.2,
      "flutterSpeed": 0.002,
      "colorVar": "--ink-amber",
      "colorAlpha": 0.3,
      "colorAlphaVariance": 0.5,
      "depthSpeedVariance": 0.5,
      "depthSizeVariance": 0.25,
      "sizeJitter": 0.15
    },
    {
      "id": "leaf",
      "weight": 46,
      "shapeIds": ["leaf-falling", "leaf-oak", "leaf-maple", "leaf-chestnut"],
      "iconSize": 16,
      "maxSpeed": 2.6,
      "speedPerNeighbor": 0.008,
      "rotationSmoothing": 0.06,
      "flutterAmplitude": 0.45,
      "flutterSpeed": 0.004,
      "colorVar": "--ink-green",
      "colorAlpha": 0.3,
      "colorAlphaVariance": 0.5,
      "depthSpeedVariance": 0.5,
      "depthSizeVariance": 0.3,
      "sizeJitter": 0.2
    }
  ]
}
